{
  "schema": "distributed_world_simulator.harness_event.v1",
  "event_id": "V0-P5-R2-EVENT-0029",
  "project_epoch": "E2026-08-19-V0-P5-R2",
  "work_order_id": "V0-P5-R2-WO-001",
  "sequence": 29,
  "event_type": "PREDICATE_VERIFIED",
  "work_state": "VERIFYING",
  "recorded_at_utc": "2026-08-21T02:34:22Z",
  "actor": "DIRECTOR",
  "branch": "repair/v0-p5-closure-r2",
  "head_sha": "5434558856c00b588eed5369d2c613cd4b9858bb",
  "summary": "DIRECTIONAL_PC0_NON_RED_FOR_CRITICAL_HITS is durably established from exact existing evidence and the post-integration campaign.",
  "predicate": "DIRECTIONAL_PC0_NON_RED_FOR_CRITICAL_HITS",
  "command": "MATERIALIZE_DIRECTIONAL_PC0_NON_RED_FOR_CRITICAL_HITS",
  "evidence_paths": [
    "config/control/harness/executions/E2026-08-19-V0-P5-R2/evidence/P5-R2-POST-INTEGRATION-PC0-001.v1.json"
  ],
  "exit_code": 0
}
