{
  "schema": "distributed_world_simulator.harness_event.v1",
  "event_id": "E2026-08-23-V0-P6-R2-V0-P6-R2-WO-001-0029",
  "project_epoch": "E2026-08-23-V0-P6-R2",
  "work_order_id": "V0-P6-R2-WO-001",
  "sequence": 29,
  "event_type": "PREDICATE_VERIFIED",
  "work_state": "VERIFIED",
  "recorded_at_utc": "2026-08-23T08:29:00Z",
  "actor": "IMPLEMENTER",
  "branch": "feature/v0-p6-persistent-shared-outpost",
  "head_sha": "9e0cc74fdab020d35ec52d501c2b15614298c4a7",
  "summary": "Predicate V0_P6_CHECKPOINT_PROPOSED durably proven.",
  "command": "RECORD_PREDICATE_VERIFIED",
  "exit_code": 0,
  "predicate": "V0_P6_CHECKPOINT_PROPOSED"
}
