{
  "schema": "distributed_world_simulator.harness_event.v1",
  "event_id": "E2026-08-11-H0-0-R1-H0-0-WO-001-0040",
  "project_epoch": "E2026-08-11-H0-0-R1",
  "work_order_id": "H0-0-WO-001",
  "sequence": 40,
  "event_type": "CHECKPOINT_PROPOSED",
  "work_state": "CHECKPOINT_PROPOSED",
  "recorded_at_utc": "2026-08-11T06:43:09Z",
  "actor": "DIRECTOR",
  "branch": "control/h0-closed-loop-development",
  "head_sha": "cedebf34530f0ddd134aed8cbe5a1b691fdeb592",
  "predicate": "H0_0_SCAFFOLD_READY",
  "command": "Propose H0_0_SCAFFOLD_READY after exact-head review, verification, Evidence Map and non-RED PC0",
  "exit_code": 0,
  "evidence_paths": [
    "config/control/harness/executions/E2026-08-11-H0-0-R1/evidence/H0-0-WO-001-EVIDENCE-MAP-002.v1.json",
    "config/control/harness/executions/E2026-08-11-H0-0-R1/evidence/H0-0-WO-001-VALIDATION-SUMMARY-002.v1.json",
    "config/control/harness/executions/E2026-08-11-H0-0-R1/reviews/H0-0-WO-001-POSTBUILD-REVIEW-007.v1.json",
    "config/control/harness/executions/E2026-08-11-H0-0-R1/verifications/H0-0-WO-001-VERIFIER-003.v1.json",
    "config/control/harness/executions/E2026-08-11-H0-0-R1/critiques/H0-0-WO-001-POSTBUILD-CRITIQUE-003.v1.json"
  ],
  "summary": "H0.0 restart-safe harness scaffold is proposed for checkpoint acceptance and awaits the CONTROL_DOCS_ONLY_MERGE human gate.",
  "blocker": ""
}
