{
  "schema": "distributed_world_simulator.harness_event.v1",
  "event_id": "E2026-08-11-H0-0-R3-H0-0-R3-WO-001-0025",
  "project_epoch": "E2026-08-11-H0-0-R3",
  "work_order_id": "H0-0-R3-WO-001",
  "sequence": 25,
  "event_type": "CHECKPOINT_PROPOSED",
  "work_state": "CHECKPOINT_PROPOSED",
  "recorded_at_utc": "2026-08-11T11:10:00Z",
  "actor": "DIRECTOR",
  "branch": "control/h0-closed-loop-development-r3",
  "head_sha": "8deffb80c3e445ef9b8d556d2a1fc2666abea8fc",
  "predicate": "H0_0_SCAFFOLD_READY",
  "command": "H0.0 R3 guarded checkpoint proposal after Windows clean-clone verification, moved-main recovery confirmation, final Evidence Map, independent Reviewer/Verifier PASS, and final GitHub Project Control NON_RED fence",
  "exit_code": 0,
  "evidence_paths": [
    "config/control/harness/executions/E2026-08-11-H0-0-R3/evidence/H0-0-R3-WO-001-FINAL-EVIDENCE-MAP-001.v1.json",
    "config/control/harness/executions/E2026-08-11-H0-0-R3/reviews/H0-0-R3-WO-001-FINAL-REVIEW-002.v1.json",
    "config/control/harness/executions/E2026-08-11-H0-0-R3/verification/H0-0-R3-WO-001-VERIFIER-002.v1.json",
    "config/control/harness/executions/E2026-08-11-H0-0-R3/evidence/H0-0-R3-WO-001-PC0-FINAL-001.v1.json",
    "config/control/harness/executions/E2026-08-11-H0-0-R3/evidence/H0-0-R3-WO-001-WINDOWS-EXECUTION-001.v1.json",
    "config/control/harness/executions/E2026-08-11-H0-0-R3/evidence/H0-0-R3-WO-001-WINDOWS-MOVED-MAIN-EXECUTION-001.v1.json",
    "config/control/harness/executions/E2026-08-11-H0-0-R3/audits/H0-0-R3-WO-001-MAIN-8C388D-REG68-AUDIT-001.v1.json",
    "config/control/harness/executions/E2026-08-11-H0-0-R3/critique/H0-0-R3-WO-001-POSTBUILD-CRITIQUE-001.v1.json"
  ],
  "summary": "H0_0_SCAFFOLD_READY is proposed. All required H0.0 predicates are satisfied; final Evidence Map, Reviewer and Verifier pass; final standard and directional PC0 are NON_RED; descendant-main audit continuation is proven by Windows public commands; C22/runtime remain blocked. This terminal Work Order event does not authorize merge. CONTROL_DOCS_ONLY_MERGE remains an explicit human gate with a final freshness fence required immediately before merge."
}
