{
  "schema": "distributed_world_simulator.harness_event.v1",
  "event_id": "E2026-08-30-V0-P7-R1-V0-P7-R1-WO-001-0007",
  "project_epoch": "E2026-08-30-V0-P7-R1",
  "work_order_id": "V0-P7-R1-WO-001",
  "sequence": 7,
  "event_type": "IMPLEMENTATION_COMMITTED",
  "work_state": "IN_PROGRESS",
  "recorded_at_utc": "2026-09-02T06:45:00Z",
  "actor": "DIRECTOR",
  "branch": "feature/v0-p7-bounded-terrain-mutation",
  "head_sha": "ba8210a8d3cddf084a573f2e862982d3f76c37c9",
  "predicate": "P7_5_POST_BUILD_GREEN_READY_FOR_FRESH_REVIEW",
  "command": "FREEZE_P7_5_RUNTIME_AND_DISPATCH_FRESH_REVIEWER",
  "exit_code": 0,
  "evidence_paths": [
    "config/control/harness/executions/E2026-08-30-V0-P7-R1/evidence/V0-P7-R1-P7-5-EVIDENCE-MAP-001.v1.json",
    "config/control/harness/executions/E2026-08-30-V0-P7-R1/evidence/V0-P7-R1-P7-5-LINUX-EXACT-RUNTIME-VALIDATION-001.v1.json",
    "config/control/harness/executions/E2026-08-30-V0-P7-R1/evidence/V0-P7-R1-WO-001-P7-5-M7-REPLICA-REPAIR-AMENDMENT-001.v1.json"
  ],
  "summary": "P7.5 runtime subject ba8210a8d3cddf084a573f2e862982d3f76c37c9 / tree f35e3a1acbe587de6a8f9bb9cef1f3949d5eea53 is frozen after exact Linux full-gate GREEN. The six-file delta includes a bounded M7 replica representation repair formally authorized before independent review/merge. Fresh Independent Reviewer is now the only next actor; runtime mutation and merge remain forbidden."
}
