{
  "schema": "distributed_world_simulator.harness_event.v1",
  "event_id": "E2026-09-09-V0-MVP-R1-V0-MVP-R1-WO-001-0023-MVP7-POST-BUILD-CRITIQUE-COMPLETED",
  "project_epoch": "E2026-09-09-V0-MVP-R1",
  "work_order_id": "V0-MVP-R1-WO-001",
  "sequence": 23,
  "event_type": "PREDICATE_VERIFIED",
  "work_state": "IN_PROGRESS",
  "recorded_at_utc": "2026-09-19T14:17:05Z",
  "actor": "IMPLEMENTER",
  "branch": "feature/v0-mvp-playable-seamless-planet-r1",
  "head_sha": "ad48b24d8cde350db8c26adb958d9a0d62c6ff56",
  "predicate": "MVP7_POST_BUILD_CRITIQUE_COMPLETED",
  "command": "MVP7-POST-BUILD-CRITIQUE-COMPLETED",
  "exit_code": 0,
  "evidence_paths": [
    "config/control/harness/executions/E2026-09-09-V0-MVP-R1/evidence/MVP7-POST-BUILD-CRITIQUE-AD48B24D-R1.v1.json",
    "config/control/harness/executions/E2026-09-09-V0-MVP-R1/evidence/MVP7-IMPLEMENTER-EXACT-EVIDENCE-AD48B24D-R1.v1.json"
  ],
  "summary": "Bounded MVP7 post-build critique found no material runtime refactor required. Remaining items are closure evidence only: fresh independent Reviewer/Verifier, exact full world/core and PC0. Parent Work Order remains IN_PROGRESS and MVP8 is not started."
}
