{
  "schema": "distributed_world_simulator.harness_event.v1",
  "event_id": "E2026-08-11-H0-1-R6-H0-1-R6-C22-WO-001-0009",
  "project_epoch": "E2026-08-11-H0-1-R6",
  "work_order_id": "H0-1-R6-C22-WO-001",
  "sequence": 9,
  "event_type": "PREDICATE_VERIFIED",
  "work_state": "VERIFYING",
  "recorded_at_utc": "2026-08-11T14:35:20Z",
  "actor": "VERIFIER",
  "branch": "feature/h0-1-c22-current-main-r1",
  "head_sha": "1112d1f7cfad1df18fb3621a537e191e674848c6",
  "predicate": "PROJECT_EPOCH_CREATED",
  "command": "VERIFY_H0_1_R6_EPOCH_IDENTITY",
  "exit_code": 0,
  "evidence_paths": ["config/control/harness/executions/E2026-08-11-H0-1-R6/project-epoch.v1.json"],
  "summary": "Verified H0.1 R6 was created from exact canonical main 1112d1f7 with registry generation 75 and H0.1 eligible checkpoint."
}
