{
  "schema":"distributed_world_simulator.harness_event.v1","event_id":"V0-P4-R1-EVENT-0024","project_epoch":"E2026-08-17-V0-P4-R1","work_order_id":"V0-P4-R1-WO-001","sequence":24,"event_type":"PREDICATE_VERIFIED","work_state":"VERIFYING","recorded_at_utc":"2026-08-18T00:40:08Z","actor":"DIRECTOR","branch":"feature/v0-p4-construction-real-resources","head_sha":"2a6721cdf02fa1134c59d1ab98bb7b597c66821d","predicate":"V0_P4_DESIGN_BRIEF_READY","command":"MATERIALIZE_COMMITTED_EVIDENCE::V0_P4_DESIGN_BRIEF_READY","exit_code":0,"evidence_paths":["config/control/harness/executions/E2026-08-17-V0-P4-R1/work-orders/V0-P4-R1-WO-001.v1.json","config/control/harness/executions/E2026-08-17-V0-P4-R1/evidence/P4-CLOSURE-EVIDENCE-MAP-001.v1.json"],"summary":"Append-only control binding for V0_P4_DESIGN_BRIEF_READY. The predicate is materialized from committed P4 evidence and/or already-completed independent review/control evidence; no production or test mutation is introduced."
}
