{
  "schema": "distributed_world_simulator.harness_event.v1",
  "event_id": "V0-P4-R1-EVENT-0020",
  "project_epoch": "E2026-08-17-V0-P4-R1",
  "work_order_id": "V0-P4-R1-WO-001",
  "sequence": 20,
  "event_type": "PREDICATE_VERIFIED",
  "work_state": "IN_PROGRESS",
  "recorded_at_utc": "2026-08-17T12:06:20Z",
  "actor": "IMPLEMENTER",
  "branch": "feature/v0-p4-construction-real-resources",
  "head_sha": "fa13bf38d299facfd75381aecee221356f460519",
  "predicate": "V0_P4_NETWORK_BASELINE_SERVER_PREDICTED_PASS",
  "evidence_paths": ["config/control/harness/executions/E2026-08-17-V0-P4-R1/evidence/P4-6-LIVE-TWO-CLIENT-RECONNECT-GREEN-001.v1.json", "config/control/harness/executions/E2026-08-17-V0-P4-R1/evidence/P4-CLOSURE-HARNESS-EVIDENCE-MAP-001.v1.json"],
  "summary": "P4 real-ENet validation executes on the existing SERVER_PREDICTED network authority baseline. P4 introduces no new client-owned gameplay authority, prediction foundation, transport protocol owner, or scripts/network foundation mutation."
}
