{
  "schema": "distributed_world_simulator.harness_event.v1",
  "event_id": "E2026-09-09-V0-MVP-R1-V0-MVP-R1-WO-001-0009-RECONCILED",
  "project_epoch": "E2026-09-09-V0-MVP-R1",
  "work_order_id": "V0-MVP-R1-WO-001",
  "sequence": 9,
  "event_type": "IMPLEMENTATION_COMMITTED",
  "work_state": "IN_PROGRESS",
  "recorded_at_utc": "2026-09-13T02:51:54Z",
  "actor": "DIRECTOR",
  "branch": "feature/v0-mvp-playable-seamless-planet-r1",
  "head_sha": "e0fafdfed4711fe9e43d728f15a5a19869151320",
  "predicate": "MVP3_GRAPHICAL_PROCESS_ROUNDTRIP_IMPLEMENTATION",
  "command": ".\\RUN_V0_MVP3_NATIVE_ROUNDTRIP.ps1; .\\RUN_V0_MVP3_GRAPHICAL_ROUNDTRIP.ps1",
  "exit_code": 0,
  "evidence_paths": [
    "config/control/harness/executions/E2026-09-09-V0-MVP-R1/audits/MVP3-CONTINUATION-AUDIT-7DFC68AB-R2.v1.json",
    "config/control/harness/executions/E2026-09-09-V0-MVP-R1/supporting-evidence/MVP3-NATIVE-PROCESS-ROUNDTRIP-C2F5ED6A-R1.v1.json",
    "config/control/harness/executions/E2026-09-09-V0-MVP-R1/supporting-evidence/MVP3-GRAPHICAL-PROCESS-ROUNDTRIP-E0FAFDFE-R1.v1.json"
  ],
  "summary": "Canonical reconstruction of the preserved MVP3 continuation audit and Implementer process evidence. The Work Order remains IN_PROGRESS; this event does not verify MVP3, authorize merge or claim product acceptance."
}
